jornada,partido,rival,resultado,sistema_real_sociedad,sistema_rival,posesion_rs,posesion_rival,xg_rs,xg_rival,tiros_rs,tiros_rival,tiros_puerta_rs,tiros_puerta_rival,ocasiones_claras_rs,ocasiones_claras_rival,toques_area_rs,toques_area_rival,pases_rs,pases_rival,pases_ultimo_tercio_rs,pases_ultimo_tercio_rival,paradas_remiro,goles_evitados_remiro,tipo_partido,insight_postpartido,dif_posesion_rs,dif_xg_rs,dif_tiros_rs,dif_ocasiones_claras_rs,dif_toques_area_rs,lectura_automatica
21,Real Sociedad 3-1 Celta,Real Club Celta de Vigo,Victoria,4-4-2,3-4-3,36,64,1.61,1.6,10,17,,,3,2,15,35,350.0,622.0,,,,,Victoria mediante eficacia ofensiva y transición,"La Real Sociedad obtuvo una victoria por 3-1 pese a ceder la iniciativa del juego al rival. Con un 36% de posesión, consiguió igualar prácticamente el xG del Celta y mostró una elevada eficacia ofensiva en situaciones de transición.",-28,0.01,-7,1,-20,"La Real cede iniciativa, pero compite bien en calidad de ocasiones y eficacia ofensiva."
22,Athletic Club 1-1 Real Sociedad,Athletic Club,Empate,4-4-2,4-2-3-1,45,55,1.66,0.97,8,19,6.0,4.0,4,1,10,44,,,41.0,90.0,,,Empate competitivo con ocasiones de mayor calidad,"La Real Sociedad generó menos volumen ofensivo que el Athletic, pero produjo ocasiones de mayor calidad. A pesar de adelantarse en el marcador y registrar un xG superior, terminó concediendo el empate en los minutos finales.",-10,0.69,-11,3,-34,La Real genera ocasiones de mayor calidad que el rival y justifica el resultado desde la producción ofensiva.
26,Mallorca 0-1 Real Sociedad,RCD Mallorca,Victoria,4-2-3-1,4-3-3,56,44,0.43,0.66,12,6,2.0,1.0,1,1,20,15,,,64.0,45.0,,,Victoria basada en control territorial y gestión del resultado,"Partido de control territorial por parte de la Real Sociedad. El equipo dominó la posesión y acumuló más presencia en campo rival, gestionando la ventaja obtenida por Carlos Soler mediante una estructura defensiva estable.",12,-0.23,6,0,5,La Real controla más el balón y orienta el partido hacia un escenario de dominio territorial.
20,Real Sociedad 2-1 Barcelona,FC Barcelona,Victoria,4-4-2,4-3-3,28,72,1.01,3.68,7,25,6.0,9.0,3,8,19,54,,,44.0,73.0,8.0,1.4,Victoria de resistencia defensiva frente a rival dominante,"La Real Sociedad logró la victoria pese a verse claramente superada en posesión, volumen ofensivo y generación de ocasiones. La eficacia ofensiva y el rendimiento de Remiro fueron determinantes para sostener el resultado.",-44,-2.67,-18,-5,-35,"Victoria de alta resistencia: el rival domina los indicadores de volumen, pero la Real sostiene el resultado con eficacia y rendimiento diferencial del portero."
28,Real Sociedad 3-1 Osasuna,CA Osasuna,Victoria,4-1-4-1,4-2-3-1,49,51,2.13,0.65,14,13,6.0,5.0,3,1,23,21,385.0,382.0,,,,,Victoria mediante superioridad en calidad de ocasiones,"Aunque el volumen de juego fue equilibrado, la Real Sociedad consiguió generar ocasiones de mucha mayor calidad que Osasuna. La diferencia de xG explica la superioridad mostrada en el marcador final.",-2,1.48,1,2,2,La Real genera ocasiones de mayor calidad que el rival y justifica el resultado desde la producción ofensiva.
