estilo_tactico,equipos,media_global,media_dominio,media_amenaza,media_eficacia,media_presion,media_solidez,lectura_vs_real_sociedad
Control con poca amenaza,1,48.91,66.17,28.57,53.5,55.26,41.56,"Rivales que pueden discutir posesión, aunque su amenaza ofensiva es más limitada."
Dominador ofensivo,2,79.11,90.25,82.69,83.47,63.48,64.4,Rivales que pueden obligar a la Real Sociedad a defender más bajo y medir mejor la presión.
Equipo de presión y solidez,4,40.44,31.58,27.23,27.33,67.89,67.24,Rivales incómodos porque pueden igualar intensidad y castigar errores en salida.
Equipo reactivo / bloque bajo,5,34.65,28.0,30.07,52.99,15.37,48.21,Rivales peligrosos si la Real Sociedad pierde el balón en zonas interiores o queda desprotegida tras atacar.
Perfil mixto,5,42.39,46.77,36.9,51.04,25.03,50.05,"Rivales variables, con capacidad para alternar fases de control, presión y repliegue."
Producción ofensiva limitada,2,29.72,33.95,22.44,11.41,45.68,43.29,Rivales ante los que la Real Sociedad debería imponer presión alta y dominio territorial.
